What was the average duration of the LOS in Central Asia?,The average duration of the LOS in Central Asia was 2591 days,Rainfall Dynamics,"rainfall, rainfalls, irrigation, flood, streamflow, drainage, rivers, precipitation, floods, basin, precipitations, stormwater, river, fluxuation, basins, rainy, rain, meteorology, sedimentation, humidity, meteorological, watershed, average, reservoir, baseflow, averaging, droughts, averages, drought, irrigated, rainfed, flowrate, wetland, watersheds, wastewater, meteorol, groundwater, desertification, flow, climatology, median, flows, climatological, mediterranean, wetter, moisture, wet, sediments, streams, averaged",,strategy,,others,factual,OK,Analysis,,2,analysis,,factual,OK,analysis,,2,,,0,1,,2,others
What was the earliest and latest average SOS and EOS in Central Asia?,"The earliest average SOS and EOS occurred in the ASDA at 508 d and 3022 d, respectively The latest average SOS was in the HCDA at 1112 d, and the EOS was in the TBDA at 3399 d",Relation Correlation,"correlation, correlations, correlated, relation, ratios, relevance, ratio, relationship, connections, relevant, related, relationships, interconnection, index, connectivity, relations, indexes, connection, coefficients, associated, interconnected, relating, coefficient, compared, interactions, statistic, relative, linkages, statistisches, comparisons, statistical, statistics, factors, comparative, proportional, linked, associating, comparison, connected, connects, intercomparison, betweenness, percentages, relatively, comparing, statistically, linking, compares, negative, low",,strategy,,others,factual,OK,Analysis,,2,analysis,,factual,OK,analysis,,2,,,0,1,,1,others
What was the interannual trend of the LSP from 2000 to 2020 in Central Asia?,The SOS was delayed in 5366 % of the study area with an overall rate of change of + 012 dyr1 The overall EOS was advanced at a rate of 038 dyr1 with a maximum advance rate of 067 dyr1,Relation Correlation,"correlation, correlations, correlated, relation, ratios, relevance, ratio, relationship, connections, relevant, related, relationships, interconnection, index, connectivity, relations, indexes, connection, coefficients, associated, interconnected, relating, coefficient, compared, interactions, statistic, relative, linkages, statistisches, comparisons, statistical, statistics, factors, comparative, proportional, linked, associating, comparison, connected, connects, intercomparison, betweenness, percentages, relatively, comparing, statistically, linking, compares, negative, low",,others,Q,analysis,strategy,,Analysis,OK,2,analysis,OK,strategy,,analysis,OK,2,,,1,2,,,analysis
What are the changes in the land surface phenology of different ecological zones?,"The land surface phenology of different ecological zones changed with a mean SOS 45-105days/803 days, EOS 305-355 days/3397 days and LOS 200-300 days/2601 days with trends of +017 days/yr, -031 days/yr and -060 days/yr respectively",Bio-Fishery Ecosys.,"fisheries, fishing, zooplankton, bioclimatic, fish, fishery, fishes, biodiversity, phytoplankton, bioavailability, planktonic, lakes, ecotypes, biosphere, ecosystems, aquaculture, biospheric, anglerfish, bioavailable, snailfish, ecology, lake, ecosystem, biosourced, ecological, zoologii, biotic, climatology, biomass, oceanography, aquatic, bioproject, habitats, biogeography, biogeochemical, biofuels, bioenergy, bioorganic, climatological, biogas, habitat, biophysical, biofuel, freshwater, biobased, biomod, seawater, species, biomethane, ecologization",,others,,analysis,factual,,Analysis,OK,2,analysis,OK,science&tech,,science & technology,,1,2,,1,,,1,analysis
What is the percentage of phenological day ranges?,"The percentage of phenological day ranges varies from region to region The highest percentage of phenological day ranges for SOS was 2259%, for EOS was 1515% and for LOS was 2371%",Relation Correlation,"correlation, correlations, correlated, relation, ratios, relevance, ratio, relationship, connections, relevant, related, relationships, interconnection, index, connectivity, relations, indexes, connection, coefficients, associated, interconnected, relating, coefficient, compared, interactions, statistic, relative, linkages, statistisches, comparisons, statistical, statistics, factors, comparative, proportional, linked, associating, comparison, connected, connects, intercomparison, betweenness, percentages, relatively, comparing, statistically, linking, compares, negative, low",,others,,analysis,analysis,OK,Analysis,OK,2,analysis,OK,analysis,OK,analysis,OK,4,,,1,,,,analysis
What were the increasing trends of TXmean and TNmean mainly observed in Central Asia?,"The increasing trends of TXmean and TNmean were mainly observed in the ASDA, TBDA, and HCDA ecoregions in Central Asia",Relation Correlation,"correlation, correlations, correlated, relation, ratios, relevance, ratio, relationship, connections, relevant, related, relationships, interconnection, index, connectivity, relations, indexes, connection, coefficients, associated, interconnected, relating, coefficient, compared, interactions, statistic, relative, linkages, statistisches, comparisons, statistical, statistics, factors, comparative, proportional, linked, associating, comparison, connected, connects, intercomparison, betweenness, percentages, relatively, comparing, statistically, linking, compares, negative, low",,strategy,,analysis,strategy,*,Analysis,OK,2,analysis,OK,analysis,OK,analysis,OK,3,,,2,,,,analysis
What was the rate of decrease of RX1day and RX5day?,The rate of decrease of RX1day and RX5day was -0259 mmyr1 and -0210 mmyr1 respectively,Relation Correlation,"correlation, correlations, correlated, relation, ratios, relevance, ratio, relationship, connections, relevant, related, relationships, interconnection, index, connectivity, relations, indexes, connection, coefficients, associated, interconnected, relating, coefficient, compared, interactions, statistic, relative, linkages, statistisches, comparisons, statistical, statistics, factors, comparative, proportional, linked, associating, comparison, connected, connects, intercomparison, betweenness, percentages, relatively, comparing, statistically, linking, compares, negative, low",,science and tech,Q,analysis,science&tech,Q,Analysis,OK,2,analysis,OK,science&tech,Q,analysis,OK,2,3,,,,,,analysis
How many stations exhibited significant changes in DTR?,48 stations exhibited significant changes in DTR,quantile quantities,"many, quantile, quantities, numerous, quant, multiple, quantiles, several, multiplied, numbers, multinomial, coefficients, quantity, buildings, multiplying, numerically, structures, estruturas, multi, few, figures, lot, cumulative, multiobjective, constructions, quantify, quantifying, coefficient, multivariate, amount, severalbig, quantitative, integer, polynomial, infrastructural, infrastructures, building, numerical, aggregates, population, number, dwa, multistage, millions, structure, infrastructure, amounts, quantitatively, multisource, billions",,science and tech,,analysis,strategy,,Analysis,OK,2,analysis,OK,science&tech,Q,analysis,OK,2,2,,,1,,,analysis
What is the most significant change among the warm indices?,"TN90p has the most significant change among the warm indices, with a rate of 0306 dyr1",Relation Correlation,"correlation, correlations, correlated, relation, ratios, relevance, ratio, relationship, connections, relevant, related, relationships, interconnection, index, connectivity, relations, indexes, connection, coefficients, associated, interconnected, relating, coefficient, compared, interactions, statistic, relative, linkages, statistisches, comparisons, statistical, statistics, factors, comparative, proportional, linked, associating, comparison, connected, connects, intercomparison, betweenness, percentages, relatively, comparing, statistically, linking, compares, negative, low",,science and tech,OK,science and tech,strategy,,Ethics and Regulation,,9,analysis,Q,strategy,,science & technology,OK,1,2,,,2,,,science and tech
What was the relationship between the SOS and ECI?,"The SOS had mostly low to moderate negative correlations with the ECI, except for TNx, TX10p and TN10p",Relation Correlation,"correlation, correlations, correlated, relation, ratios, relevance, ratio, relationship, connections, relevant, related, relationships, interconnection, index, connectivity, relations, indexes, connection, coefficients, associated, interconnected, relating, coefficient, compared, interactions, statistic, relative, linkages, statistisches, comparisons, statistical, statistics, factors, comparative, proportional, linked, associating, comparison, connected, connects, intercomparison, betweenness, percentages, relatively, comparing, statistically, linking, compares, negative, low",,science and tech,Q,analysis,science&tech,Q,Analysis,OK,2,analysis,OK,science&tech,Q,science & technology,,1,4,,,,,,analysis
What was the significant correlation between the SOS and temperature indices?,"The SOS had primarily negative correlations with the warm indices, and there were more areas where the SOS was significantly correlated with TX90p and TN90p at P < 005",Relation Correlation,"correlation, correlations, correlated, relation, ratios, relevance, ratio, relationship, connections, relevant, related, relationships, interconnection, index, connectivity, relations, indexes, connection, coefficients, associated, interconnected, relating, coefficient, compared, interactions, statistic, relative, linkages, statistisches, comparisons, statistical, statistics, factors, comparative, proportional, linked, associating, comparison, connected, connects, intercomparison, betweenness, percentages, relatively, comparing, statistically, linking, compares, negative, low",,science and tech,Q,analysis,science&tech,Q,Analysis,OK,2,analysis,OK,science&tech,Q,science & technology,Q,1,4,,,,,,analysis
How is the SOS positively correlated with cold indices?,"In most areas, the SOS was positively correlated with the cold indices, and moderately significant positive correlation areas were distributed in the southeastern NSCA and northern JBDA",Relation Correlation,"correlation, correlations, correlated, relation, ratios, relevance, ratio, relationship, connections, relevant, related, relationships, interconnection, index, connectivity, relations, indexes, connection, coefficients, associated, interconnected, relating, coefficient, compared, interactions, statistic, relative, linkages, statistisches, comparisons, statistical, statistics, factors, comparative, proportional, linked, associating, comparison, connected, connects, intercomparison, betweenness, percentages, relatively, comparing, statistically, linking, compares, negative, low",,others,,analysis,science&tech,,Analysis,OK,2,analysis,OK,science&tech,,science & technology,,1,3,,1,,,,analysis
How is the SOS correlated with RX1day and RX5day?,"The SOS showed a moderate and low negative correlation with the two precipitation indices of RX1day and RX5day, mainly in the western and central NSCA, with 383% and 585% of the areas with P < 005, respectively",Relation Correlation,"correlation, correlations, correlated, relation, ratios, relevance, ratio, relationship, connections, relevant, related, relationships, interconnection, index, connectivity, relations, indexes, connection, coefficients, associated, interconnected, relating, coefficient, compared, interactions, statistic, relative, linkages, statistisches, comparisons, statistical, statistics, factors, comparative, proportional, linked, associating, comparison, connected, connects, intercomparison, betweenness, percentages, relatively, comparing, statistically, linking, compares, negative, low",,strategy,,analysis,science&tech,Q,Analysis,OK,2,analysis,OK,science&tech,Q,science & technology,Q,1,3,,,1,,,analysis
"What do the blue, red, and gray areas represent in Figs 5, 6, and 7?","The blue areas represent negative correlation, the red areas represent positive correlation, and the gray areas represent weak correlations",Relation Correlation,"correlation, correlations, correlated, relation, ratios, relevance, ratio, relationship, connections, relevant, related, relationships, interconnection, index, connectivity, relations, indexes, connection, coefficients, associated, interconnected, relating, coefficient, compared, interactions, statistic, relative, linkages, statistisches, comparisons, statistical, statistics, factors, comparative, proportional, linked, associating, comparison, connected, connects, intercomparison, betweenness, percentages, relatively, comparing, statistically, linking, compares, negative, low",,ethics and regulation,,analysis,science&tech,Q,Analysis,OK,2,analysis,OK,science&tech,Q,science & technology,Q,1,3,1,,,,,analysis
"What do the value in the lower left corner and the percentages in the upper right corner represent in Figs 5, 6, and 7?","The value in the lower left corner in each plot represents the mean correlation value, and the percentages in the upper right corner represent the area proportion of correlation",Quantifying Coefficients,"coefficients, coefficient, equation, calculates, calculating, equations, calculation, calculations, exponential, calculated, mathematical, computational, computation, quantifying, calculate, computationally, quantify, mathematically, formulas, numerically, compute, formula, comput, constants, factor, exponent, variables, factors, quantified, decimal, quadratic, quantitative, computing, computed, equilibrium, logarithmic, numerical, variable, theorem, determinants, algorithm, algorithms, logarithm, ratios, ratio, derivative, polynomial, constant, quantitatively, figures",,ethics and regulation,,analysis,science&tech,Q,Analysis,OK,2,analysis,OK,science&tech,Q,science & technology,Q,1,3,1,,,,,analysis
What is the spatial distribution of correlation coefficient between the EOS and ECIs during 2000-2020 in Central Asia?,"The significant correlation area of EOS with TXmean accounted for 1845% of the study area, and the moderately positively correlated areas were widely distributed in the western and eastern NSCA and the western part of JBDA",Relation Correlation,"correlation, correlations, correlated, relation, ratios, relevance, ratio, relationship, connections, relevant, related, relationships, interconnection, index, connectivity, relations, indexes, connection, coefficients, associated, interconnected, relating, coefficient, compared, interactions, statistic, relative, linkages, statistisches, comparisons, statistical, statistics, factors, comparative, proportional, linked, associating, comparison, connected, connects, intercomparison, betweenness, percentages, relatively, comparing, statistically, linking, compares, negative, low",,science and tech,Q,analysis,science&tech,Q,Analysis,OK,2,analysis,OK,science&tech,Q,analysis,OK,2,3,,,,,,analysis
What is the correlation of the EOS with the cold indices?,"The EOS was mainly negatively correlated with the cold indices in most areas, with 941% of the area being significantly correlated with TX10p The areas where the EOS was moderately negatively correlated with TX10p and TN10p were mainly in the southwestern and eastern NSCA and the northern TSMT",Relation Correlation,"correlation, correlations, correlated, relation, ratios, relevance, ratio, relationship, connections, relevant, related, relationships, interconnection, index, connectivity, relations, indexes, connection, coefficients, associated, interconnected, relating, coefficient, compared, interactions, statistic, relative, linkages, statistisches, comparisons, statistical, statistics, factors, comparative, proportional, linked, associating, comparison, connected, connects, intercomparison, betweenness, percentages, relatively, comparing, statistically, linking, compares, negative, low",,others,,analysis,science&tech,Q,Analysis,OK,2,analysis,OK,science&tech,Q,analysis,OK,2,2,,1,,,,analysis
What is the area proportion of positive correlation between the EOS and the precipitation indices?,The area proportion of positive correlation between the EOS and the precipitation indices was about 50%,Relation Correlation,"correlation, correlations, correlated, relation, ratios, relevance, ratio, relationship, connections, relevant, related, relationships, interconnection, index, connectivity, relations, indexes, connection, coefficients, associated, interconnected, relating, coefficient, compared, interactions, statistic, relative, linkages, statistisches, comparisons, statistical, statistics, factors, comparative, proportional, linked, associating, comparison, connected, connects, intercomparison, betweenness, percentages, relatively, comparing, statistically, linking, compares, negative, low",,ethics and regulation,,analysis,science&tech,Q,Analysis,OK,2,analysis,OK,factual,,analysis,OK,2,1,1,,,,1,analysis
What percentage of Central Asia passed the significance test P < 005?,"Only a small fraction, passing the significance test P < 005 in Central Asia, accounting for only 161 % and 070 % of Central Asia, respectively",Relation Correlation,"correlation, correlations, correlated, relation, ratios, relevance, ratio, relationship, connections, relevant, related, relationships, interconnection, index, connectivity, relations, indexes, connection, coefficients, associated, interconnected, relating, coefficient, compared, interactions, statistic, relative, linkages, statistisches, comparisons, statistical, statistics, factors, comparative, proportional, linked, associating, comparison, connected, connects, intercomparison, betweenness, percentages, relatively, comparing, statistically, linking, compares, negative, low",,others,,analysis,analysis,OK,Analysis,OK,2,analysis,OK,analysis,OK,analysis,OK,4,,,1,,,,analysis
How was the LOS correlated with the temperature indices?,"The LOS showed a predominantly positive correlation with the ECIs The LOS was positively correlated with the temperature indices, and low and moderately positive correlation areas were widely distributed in each ecoregion",Relation Correlation,"correlation, correlations, correlated, relation, ratios, relevance, ratio, relationship, connections, relevant, related, relationships, interconnection, index, connectivity, relations, indexes, connection, coefficients, associated, interconnected, relating, coefficient, compared, interactions, statistic, relative, linkages, statistisches, comparisons, statistical, statistics, factors, comparative, proportional, linked, associating, comparison, connected, connects, intercomparison, betweenness, percentages, relatively, comparing, statistically, linking, compares, negative, low",,science and tech,Q,analysis,science&tech,Q,Ethics and Regulation,,10,science&tech,Q,science&tech,Q,science & technology,Q,0,5,,,,,,analysis
What was the mean correlation between LOS and TXmean?,The mean correlation between LOS and TXmean was + 030,Relation Correlation,"correlation, correlations, correlated, relation, ratios, relevance, ratio, relationship, connections, relevant, related, relationships, interconnection, index, connectivity, relations, indexes, connection, coefficients, associated, interconnected, relating, coefficient, compared, interactions, statistic, relative, linkages, statistisches, comparisons, statistical, statistics, factors, comparative, proportional, linked, associating, comparison, connected, connects, intercomparison, betweenness, percentages, relatively, comparing, statistically, linking, compares, negative, low",,strategy,,analysis,strategy,*,Analysis,OK,2,analysis,OK,analysis,OK,science & technology,,2,1,,,2,,,analysis
What was the most important driver for the phenological response in the NSCA and JBDA?,TX90p was the most important driver for the phenological response in the NSCA and JBDA,Researching Ecology,"researching, research, researched, researches, climatology, studies, investigations, study, investigated, climatological, investigation, investigate, researcher, objective, exploration, exploring, researchers, purpose, objectives, seek, investigates, search, ecology, estudios, ecological, ecologization, seeks, purposes, studied, explore, why, geological, survey, climatic, investigating, explores, surveyed, goals, finding, explored, discovery, retrieval, studya, find, discover, bioclimatic, targets, studying, target, cfa",,strategy,OK,strategy,strategy,OK,Analysis,,2,analysis,,science&tech,,science & technology,,1,2,,,2,,,strategy
What was the second most influential ECI in the NSCA?,TN10p was the second most influential ECI in the NSCA after TX90p,Relation Correlation,"correlation, correlations, correlated, relation, ratios, relevance, ratio, relationship, connections, relevant, related, relationships, interconnection, index, connectivity, relations, indexes, connection, coefficients, associated, interconnected, relating, coefficient, compared, interactions, statistic, relative, linkages, statistisches, comparisons, statistical, statistics, factors, comparative, proportional, linked, associating, comparison, connected, connects, intercomparison, betweenness, percentages, relatively, comparing, statistically, linking, compares, negative, low",,strategy,OK,others,science&tech,,Analysis,Q,2,analysis,Q,science&tech,,analysis,Q,2,2,,0,1,,,others
What was the best model setting in the study?,"The best model setting, based on trial-and-error, was 600 decision trees and an mtry of 4",Dryland Experimentation,"soil, soils, experimentation, dryland, sampled, desertification, sedimentation, experimental, samples, sample, experiment, groundwater, experiments, droughts, earths, landfills, croplands, ground, methods, sediments, cement, land, experimentally, clay, drought, terrain, methodologies, sampling, trials, wetland, lands, terra, terre, method, methodology, cropland, desert, earth, experimentacin, trial, fertilizers, harvesting, probing, drying, humidity, dry, how, grasslands, ciment, erosional",,others,OK,others,science&tech,,Strategy and Management,,3,science&tech,,science&tech,,science & technology,,,4,,1,,,,others
What was the greatest effect on the SOS?,"The greatest effect on the SOS was the gradual increase in TNx, especially in the NSCA and TBDA",Relation Correlation,"correlation, correlations, correlated, relation, ratios, relevance, ratio, relationship, connections, relevant, related, relationships, interconnection, index, connectivity, relations, indexes, connection, coefficients, associated, interconnected, relating, coefficient, compared, interactions, statistic, relative, linkages, statistisches, comparisons, statistical, statistics, factors, comparative, proportional, linked, associating, comparison, connected, connects, intercomparison, betweenness, percentages, relatively, comparing, statistically, linking, compares, negative, low",,ethics and regulation,,analysis,analysis,OK,Analysis,OK,2,analysis,OK,analysis,OK,science & technology,,3,1,1,,,,,analysis
How many extreme climate indices were chosen for future scenario analysis?,"Six extreme temperature indices TXmean, TNmean, TXx, TNx, TX90p and TX10p and two extreme precipitation indices RX1day and RX5day were chosen for future scenario analysis",Climatological Variations,"scenarios, changes, climatological, klimapositives, scenario, climatology, climatic, acclimatize, forecasting, forecasts, climatol, climates, forecast, seasonality, alterations, variability, climat, fluctuations, climate, seasons, changed, scenariomip, meteorology, winters, change, variation, variablity, forecasted, microclimate, variations, winter, modifications, varies, meteorological, climatena, volatility, fluctuation, variational, predictions, situation, volatilities, predicts, permafrost, precipitations, predicting, season, meteorol, forecaster, frost, pp",,others,,science and tech,science&tech,OK,Ethics and Regulation,,8,science&tech,OK,strategy,,science & technology,OK,,3,,1,1,,,science and tech
What can be observed about the extreme temperature indices under SSP2-45 and SSP5-85?,"Under SSP2-45 and SSP5-85, the six extreme temperature indices show a noticeable warming trend with a projected increase of 22C at the end of the 21st century compared to the mean value in the base period",Climatological Variations,"scenarios, changes, climatological, klimapositives, scenario, climatology, climatic, acclimatize, forecasting, forecasts, climatol, climates, forecast, seasonality, alterations, variability, climat, fluctuations, climate, seasons, changed, scenariomip, meteorology, winters, change, variation, variablity, forecasted, microclimate, variations, winter, modifications, varies, meteorological, climatena, volatility, fluctuation, variational, predictions, situation, volatilities, predicts, permafrost, precipitations, predicting, season, meteorol, forecaster, frost, pp",,science and tech,OK,analysis,science&tech,OK,Ethics and Regulation,,10,science&tech,OK,science&tech,OK,science & technology,OK,0,5,,,,,,analysis
What are the rates of change of the ECIs projected by the MME results?,The rates of change of the ECIs projected by the MME results from 2021 to 2100 under the SSPs scenario range from approximately 3 to 9 mm,Climatological Variations,"scenarios, changes, climatological, klimapositives, scenario, climatology, climatic, acclimatize, forecasting, forecasts, climatol, climates, forecast, seasonality, alterations, variability, climat, fluctuations, climate, seasons, changed, scenariomip, meteorology, winters, change, variation, variablity, forecasted, microclimate, variations, winter, modifications, varies, meteorological, climatena, volatility, fluctuation, variational, predictions, situation, volatilities, predicts, permafrost, precipitations, predicting, season, meteorol, forecaster, frost, pp",,science and tech,Q,analysis,analysis,OK,Ethics and Regulation,,8,science&tech,Q,analysis,OK,analysis,OK,1,4,,,,,,analysis
