What is the greatest monthly impact of aspect on forest vegetation changes in terrestrial ecoregions?,"Aspect has the greatest monthly impact on forest vegetation changes in TE7, where it was associated with significant changes in forest for five months of the year",Climatic Forest Impacts,"deforestation, afforestation, reforestation, forests, forest, forestry, climatological, climatology, trees, influencing, climatic, impacts, tree, impact, factors, ecotypes, ecologization, meteorological, effects, climatol, klimapositives, geological, affects, impacted, ecoregions, climates, woodward, affecting, environmental, environmentally, climat, conifers, ecological, impactful, ecology, affect, influences, shrub, acclimatize, impacting, climate, climatena, altitudes, effect, timber, firewood, geothermal, influence, affected, environment",,strategy,,analysis,science&tech,Q,Ethics and Regulation,,5,analysis,OK,strategy,,analysis,OK,2,1,,,2,,,analysis
What is the impact of anthropogenic activities on significant changes in forests at most altitudes and months?,"The impact of anthropogenic activities was stronger than that of climate change, especially at altitudes of 01400 m",Climatic Forest Impacts,"deforestation, afforestation, reforestation, forests, forest, forestry, climatological, climatology, trees, influencing, climatic, impacts, tree, impact, factors, ecotypes, ecologization, meteorological, effects, climatol, klimapositives, geological, affects, impacted, ecoregions, climates, woodward, affecting, environmental, environmentally, climat, conifers, ecological, impactful, ecology, affect, influences, shrub, acclimatize, impacting, climate, climatena, altitudes, effect, timber, firewood, geothermal, influence, affected, environment",,strategy,,analysis,strategy,*,Ethics and Regulation,,9,analysis,OK,strategy,,science & technology,,1,1,,,3,,,analysis
How are tropical evergreen mixed forests in southern Brazil affected by anthropogenic activity?,Tropical evergreen mixed forests in southern Brazil are greatly affected by anthropogenic activity,Climatic Forest Impacts,"deforestation, afforestation, reforestation, forests, forest, forestry, climatological, climatology, trees, influencing, climatic, impacts, tree, impact, factors, ecotypes, ecologization, meteorological, effects, climatol, klimapositives, geological, affects, impacted, ecoregions, climates, woodward, affecting, environmental, environmentally, climat, conifers, ecological, impactful, ecology, affect, influences, shrub, acclimatize, impacting, climate, climatena, altitudes, effect, timber, firewood, geothermal, influence, affected, environment",,strategy,,analysis,factual,,Analysis,OK,2,analysis,OK,factual,,science & technology,,1,1,,,1,,2,analysis
How does vulnerability of forests decrease with elevation?,"As the elevation increases, the vulnerability of the forests decreases according to a study by Thakur et al, 2020",Climatic Forest Impacts,"deforestation, afforestation, reforestation, forests, forest, forestry, climatological, climatology, trees, influencing, climatic, impacts, tree, impact, factors, ecotypes, ecologization, meteorological, effects, climatol, klimapositives, geological, affects, impacted, ecoregions, climates, woodward, affecting, environmental, environmentally, climat, conifers, ecological, impactful, ecology, affect, influences, shrub, acclimatize, impacting, climate, climatena, altitudes, effect, timber, firewood, geothermal, influence, affected, environment",,others,,science and tech,science&tech,OK,Analysis,,6,others,,science&tech,OK,science & technology,OK,,3,,2,,,,science and tech
What is the impact of climate change compared to anthropogenic activities in high-altitude areas?,"In high-altitude areas, climate change has a greater impact than anthropogenic activities according to research in August and September Areas higher than 1400 and 2800 m were found to be more prone to climate change than to anthropogenic activity",Climatic Forest Impacts,"deforestation, afforestation, reforestation, forests, forest, forestry, climatological, climatology, trees, influencing, climatic, impacts, tree, impact, factors, ecotypes, ecologization, meteorological, effects, climatol, klimapositives, geological, affects, impacted, ecoregions, climates, woodward, affecting, environmental, environmentally, climat, conifers, ecological, impactful, ecology, affect, influences, shrub, acclimatize, impacting, climate, climatena, altitudes, effect, timber, firewood, geothermal, influence, affected, environment",,strategy,,science and tech,factual,Q,Ethics and Regulation,,9,analysis,Q,strategy,,analysis,Q,2,1,,,1,,1,science and tech
What resulted from the reforestation policy in Central European mountains?,The reforestation policy in the Central European mountains resulted in significant greening of low-altitude forests,Climatic Forest Impacts,"deforestation, afforestation, reforestation, forests, forest, forestry, climatological, climatology, trees, influencing, climatic, impacts, tree, impact, factors, ecotypes, ecologization, meteorological, effects, climatol, klimapositives, geological, affects, impacted, ecoregions, climates, woodward, affecting, environmental, environmentally, climat, conifers, ecological, impactful, ecology, affect, influences, shrub, acclimatize, impacting, climate, climatena, altitudes, effect, timber, firewood, geothermal, influence, affected, environment",,others,,ethics and regulation,factual,Q,Analysis,,2,analysis,,factual,Q,ethics and regularisation,OK,1,,1,1,,,2,ethics and regulation
What are the primary factors of significant forest greening?,The primary factors of significant forest greening are caused by climate,Climatic Forest Impacts,"deforestation, afforestation, reforestation, forests, forest, forestry, climatological, climatology, trees, influencing, climatic, impacts, tree, impact, factors, ecotypes, ecologization, meteorological, effects, climatol, klimapositives, geological, affects, impacted, ecoregions, climates, woodward, affecting, environmental, environmentally, climat, conifers, ecological, impactful, ecology, affect, influences, shrub, acclimatize, impacting, climate, climatena, altitudes, effect, timber, firewood, geothermal, influence, affected, environment",,science and tech,,science and tech,factual,,Ethics and Regulation,,9,analysis,Q,science&tech,OK,science & technology,OK,1,3,,,,,1,science and tech
How does climate change in high altitude areas impact forest greening?,Climate change in high altitude areas can have a greater impact on significant forest greening compared to anthropogenic activities,Climatic Forest Impacts,"deforestation, afforestation, reforestation, forests, forest, forestry, climatological, climatology, trees, influencing, climatic, impacts, tree, impact, factors, ecotypes, ecologization, meteorological, effects, climatol, klimapositives, geological, affects, impacted, ecoregions, climates, woodward, affecting, environmental, environmentally, climat, conifers, ecological, impactful, ecology, affect, influences, shrub, acclimatize, impacting, climate, climatena, altitudes, effect, timber, firewood, geothermal, influence, affected, environment",,strategy,,analysis,factual,,Ethics and Regulation,,9,analysis,OK,strategy,,strategy and management,,1,,,,3,,1,analysis
What evidence is there to support a reduction in population impacting forest greening?,Evidence from the Apennine Mountains Italy and the Taurus Mountain Range Southern Anatolia has shown that reduced population and abandonment of land can result in significant forest greening,Climatic Forest Impacts,"deforestation, afforestation, reforestation, forests, forest, forestry, climatological, climatology, trees, influencing, climatic, impacts, tree, impact, factors, ecotypes, ecologization, meteorological, effects, climatol, klimapositives, geological, affects, impacted, ecoregions, climates, woodward, affecting, environmental, environmentally, climat, conifers, ecological, impactful, ecology, affect, influences, shrub, acclimatize, impacting, climate, climatena, altitudes, effect, timber, firewood, geothermal, influence, affected, environment",,others,,analysis,strategy,,Analysis,OK,2,analysis,OK,strategy,,analysis,OK,1,,,1,1,,2,analysis
How does the forest area at low altitudes compare to forest area at high altitudes in terms of browning caused by anthropogenic activities?,The forest area at low altitudes has greater browning caused by anthropogenic activities compared to the forest area at high altitudes from JanuaryJune and in December,Climatic Forest Impacts,"deforestation, afforestation, reforestation, forests, forest, forestry, climatological, climatology, trees, influencing, climatic, impacts, tree, impact, factors, ecotypes, ecologization, meteorological, effects, climatol, klimapositives, geological, affects, impacted, ecoregions, climates, woodward, affecting, environmental, environmentally, climat, conifers, ecological, impactful, ecology, affect, influences, shrub, acclimatize, impacting, climate, climatena, altitudes, effect, timber, firewood, geothermal, influence, affected, environment",,others,,analysis,factual,Q,Analysis,OK,2,analysis,OK,factual,Q,science & technology,,1,1,,1,,,2,analysis
"What anthropogenic activities contributed to the cutting of 99% of the community forests in Van Panchayt, India?",Cutting branches for fodder and fuelwood in winter,Climatic Forest Impacts,"deforestation, afforestation, reforestation, forests, forest, forestry, climatological, climatology, trees, influencing, climatic, impacts, tree, impact, factors, ecotypes, ecologization, meteorological, effects, climatol, klimapositives, geological, affects, impacted, ecoregions, climates, woodward, affecting, environmental, environmentally, climat, conifers, ecological, impactful, ecology, affect, influences, shrub, acclimatize, impacting, climate, climatena, altitudes, effect, timber, firewood, geothermal, influence, affected, environment",,strategy,,analysis,ethic and reg,,Analysis,OK,2,analysis,OK,strategy,,science & technology,,1,1,1,,2,,,analysis
"What effects have anthropogenic activities had on forests in the Alps, Himalayas, and Africa?","Anthropogenic activities such as livestock grazing, fires, and human pressure have caused more significant forest browning than climate change",Climatic Forest Impacts,"deforestation, afforestation, reforestation, forests, forest, forestry, climatological, climatology, trees, influencing, climatic, impacts, tree, impact, factors, ecotypes, ecologization, meteorological, effects, climatol, klimapositives, geological, affects, impacted, ecoregions, climates, woodward, affecting, environmental, environmentally, climat, conifers, ecological, impactful, ecology, affect, influences, shrub, acclimatize, impacting, climate, climatena, altitudes, effect, timber, firewood, geothermal, influence, affected, environment",,strategy,,analysis,strategy,*,Ethics and Regulation,,9,analysis,OK,strategy,,science & technology,,1,1,,,3,,,analysis
What causes significant forest browning in the Himalayan region?,"In the Himalayan region, anthropogenic activities are the main cause of forest fragmentation in low-altitude areas, while the cause of forest fragmentation in high-altitude areas is climate change",Climatic Forest Impacts,"deforestation, afforestation, reforestation, forests, forest, forestry, climatological, climatology, trees, influencing, climatic, impacts, tree, impact, factors, ecotypes, ecologization, meteorological, effects, climatol, klimapositives, geological, affects, impacted, ecoregions, climates, woodward, affecting, environmental, environmentally, climat, conifers, ecological, impactful, ecology, affect, influences, shrub, acclimatize, impacting, climate, climatena, altitudes, effect, timber, firewood, geothermal, influence, affected, environment",,strategy,,science and tech,ethics & reg,,Ethics and Regulation,,9,analysis,Q,strategy,,science & technology,OK,1,1,1,,2,,,science and tech
What happens due to regional precipitation reduction or temperature increase?,"Regional precipitation reduction or temperature increase can result in drought stress, which can cause leaf shedding in trees",Climatological Vegetation,"vegetation, plants, climatological, planting, climatology, factors, vegetative, cultivation, crops, plant, influencing, fertilizers, climatic, impacts, planted, croplands, deforestation, effects, ecologization, impact, soils, humidity, rainfalls, harvesting, climates, cultivated, droughts, ecotypes, soil, climatol, rainfall, climat, cropland, klimapositives, climate, ecoregions, acclimatize, meteorological, reforestation, growth, bioclimatic, factor, effect, climatena, orchards, affects, seedlings, consequences, humid, drought",,others,,science and tech,science&tech,OK,Ethics and Regulation,,10,science&tech,OK,science&tech,OK,science & technology,OK,,4,,1,,,,science and tech
What are the main factors influencing the significant browning of Picea A Dietr in the forests of Mexico?,The main factors influencing the significant browning of Picea A Dietr in the forests of Mexico are drought brought about by climate change and anthropogenic fire,Climatic Forest Impacts,"deforestation, afforestation, reforestation, forests, forest, forestry, climatological, climatology, trees, influencing, climatic, impacts, tree, impact, factors, ecotypes, ecologization, meteorological, effects, climatol, klimapositives, geological, affects, impacted, ecoregions, climates, woodward, affecting, environmental, environmentally, climat, conifers, ecological, impactful, ecology, affect, influences, shrub, acclimatize, impacting, climate, climatena, altitudes, effect, timber, firewood, geothermal, influence, affected, environment",,science and tech,Q,analysis,factual,,Ethics and Regulation,,9,analysis,OK,factual,,science & technology,Q,1,2,,,1,,1,analysis
What factors of climate change lead to significant greening and browning of forests?,"The specific factors of climate change leading to significant greening and browning of forests were different At lower altitude forests, anthropogenic activities like fire and grazing, drought and sunburn were the main factors, while at higher altitude forests, anthropogenic activities, drought and climate change were the main factors",Climatic Forest Impacts,"deforestation, afforestation, reforestation, forests, forest, forestry, climatological, climatology, trees, influencing, climatic, impacts, tree, impact, factors, ecotypes, ecologization, meteorological, effects, climatol, klimapositives, geological, affects, impacted, ecoregions, climates, woodward, affecting, environmental, environmentally, climat, conifers, ecological, impactful, ecology, affect, influences, shrub, acclimatize, impacting, climate, climatena, altitudes, effect, timber, firewood, geothermal, influence, affected, environment",,strategy,,analysis,strategy,*,Ethics and Regulation,,9,analysis,OK,strategy,,science & technology,,1,1,,,3,,,analysis
What was the main factor leading to significant forest greening every month?,Temperature was the main factor leading to significant forest greening every month,Climatic Forest Impacts,"deforestation, afforestation, reforestation, forests, forest, forestry, climatological, climatology, trees, influencing, climatic, impacts, tree, impact, factors, ecotypes, ecologization, meteorological, effects, climatol, klimapositives, geological, affects, impacted, ecoregions, climates, woodward, affecting, environmental, environmentally, climat, conifers, ecological, impactful, ecology, affect, influences, shrub, acclimatize, impacting, climate, climatena, altitudes, effect, timber, firewood, geothermal, influence, affected, environment",,science and tech,Q,analysis,strategy,,Analysis,OK,2,analysis,OK,strategy,,science & technology,Q,1,2,,,2,,,analysis
What was the most important factor for significant greening of Araucariaceae in Southern Brazil?,The most important factor for significant greening of Araucariaceae in Southern Brazil was sunshine duration,Climatological Vegetation,"vegetation, plants, climatological, planting, climatology, factors, vegetative, cultivation, crops, plant, influencing, fertilizers, climatic, impacts, planted, croplands, deforestation, effects, ecologization, impact, soils, humidity, rainfalls, harvesting, climates, cultivated, droughts, ecotypes, soil, climatol, rainfall, climat, cropland, klimapositives, climate, ecoregions, acclimatize, meteorological, reforestation, growth, bioclimatic, factor, effect, climatena, orchards, affects, seedlings, consequences, humid, drought",,science and tech,Q,analysis,science&tech,Q,Analysis,OK,2,analysis,,science&tech,Q,science & technology,Q,1,4,,,,,,analysis
What were the main conditions limiting forest growth in arid and semi-arid areas?,"The main conditions limiting forest growth in arid and semi-arid areas were precipitation and soil moisture Zhu et al, 2019",Climatic Forest Impacts,"deforestation, afforestation, reforestation, forests, forest, forestry, climatological, climatology, trees, influencing, climatic, impacts, tree, impact, factors, ecotypes, ecologization, meteorological, effects, climatol, klimapositives, geological, affects, impacted, ecoregions, climates, woodward, affecting, environmental, environmentally, climat, conifers, ecological, impactful, ecology, affect, influences, shrub, acclimatize, impacting, climate, climatena, altitudes, effect, timber, firewood, geothermal, influence, affected, environment",,strategy,,analysis,factual,OK,Analysis,OK,6,others,,factual,OK,science & technology,,0,1,,1,1,,2,analysis
What were the main factors for the browning of high-altitude forests in Austria?,"The main factors for the browning of high-altitude forests in Austria were fire exacerbated by climate change and the substantial reduction of rainfall Muller and Vacik, 2017",Climatic Forest Impacts,"deforestation, afforestation, reforestation, forests, forest, forestry, climatological, climatology, trees, influencing, climatic, impacts, tree, impact, factors, ecotypes, ecologization, meteorological, effects, climatol, klimapositives, geological, affects, impacted, ecoregions, climates, woodward, affecting, environmental, environmentally, climat, conifers, ecological, impactful, ecology, affect, influences, shrub, acclimatize, impacting, climate, climatena, altitudes, effect, timber, firewood, geothermal, influence, affected, environment",,analysis,,analysis,factual,OK,Ethics and Regulation,,9,analysis,OK,factual,OK,science & technology,,2,1,,,,,2,analysis
What policies need to be put in place for mitigating forest browning caused by anthropogenic activities?,Sustainable livelihood strategies and forest protection compensation policies need to be studied to ensure that forest browning is mitigated as much as possible while still ensuring livelihoods,Climatic Forest Impacts,"deforestation, afforestation, reforestation, forests, forest, forestry, climatological, climatology, trees, influencing, climatic, impacts, tree, impact, factors, ecotypes, ecologization, meteorological, effects, climatol, klimapositives, geological, affects, impacted, ecoregions, climates, woodward, affecting, environmental, environmentally, climat, conifers, ecological, impactful, ecology, affect, influences, shrub, acclimatize, impacting, climate, climatena, altitudes, effect, timber, firewood, geothermal, influence, affected, environment",,strategy,,ethics and regulation,ethics & reg,OK,Analysis,,2,analysis,,ethics & reg,OK,strategy and management,,1,,2,,2,,,ethics and regulation
How can drought stress caused by climate change be dealt with?,"Long-term drought cannot be dealt with solely by the water storage of the forest stem; therefore, intervention such as through artificial rainfall may be needed, which requires the formulation of relevant response measures",Climatic Forest Impacts,"deforestation, afforestation, reforestation, forests, forest, forestry, climatological, climatology, trees, influencing, climatic, impacts, tree, impact, factors, ecotypes, ecologization, meteorological, effects, climatol, klimapositives, geological, affects, impacted, ecoregions, climates, woodward, affecting, environmental, environmentally, climat, conifers, ecological, impactful, ecology, affect, influences, shrub, acclimatize, impacting, climate, climatena, altitudes, effect, timber, firewood, geothermal, influence, affected, environment",,strategy,OK,strategy,strategy,OK,Ethics and Regulation,,9,analysis,,strategy,OK,strategy and management,Q,1,,,,4,,,strategy
What climatic conditions have been considered in the study?,"The study only considered four factors temperature, precipitation, soil moisture, and sunshine duration",Climatic Factors,"climatological, climatology, factors, climatic, climatol, climates, climat, climate, climatena, klimapositives, factor, meteorology, acclimatize, meteorological, atmospheric, humidity, microclimate, atmosphere, meteorol, coefficients, influencing, humid, coefficient, correlation, correlations, causality, impacts, weather, impact, quantifying, quantitative, quantities, geothermal, quantify, influences, influence, causation, geological, variability, ozone, correlated, quantitatively, bioclimatic, variablity, reasons, ratios, influenced, rainfalls, estimations, environment",,analysis,,others,science&tech,,Analysis,,11,others,OK,science&tech,,science & technology,,1,3,,1,,,,others
What kind of uncertainties does remote sensing data have?,Remote sensing data has uncertainties such as land use data must be interpreted and corrected manually in the production process,Data Analysis Methods,"dataset, data, datasets, datastream, statistics, statistic, statistical, statistisches, estimations, statigraphs, analyzing, analyzed, analysis, statistically, analyze, methodologies, datasheets, methodology, meteorology, analysing, estimation, analyses, estimates, estimate, methodological, climatology, methods, analytical, meteorological, accuracy, determining, used, analytic, metric, climatological, analyzer, utilizing, utilized, metrics, predictability, method, utilisation, analyse, analysed, usage, utilization, how, forecasts, measurement, deterministic",,science and tech,OK,science and tech,strategy,,Strategy and Management,,3,science&tech,OK,science&tech,OK,science & technology,OK,,4,,,1,,,science and tech
What was the aim of this study?,The aim of this study was to explore the impact of anthropogenic activities and climate change on global forest change at distinct altitudes,Climatic Forest Impacts,"deforestation, afforestation, reforestation, forests, forest, forestry, climatological, climatology, trees, influencing, climatic, impacts, tree, impact, factors, ecotypes, ecologization, meteorological, effects, climatol, klimapositives, geological, affects, impacted, ecoregions, climates, woodward, affecting, environmental, environmentally, climat, conifers, ecological, impactful, ecology, affect, influences, shrub, acclimatize, impacting, climate, climatena, altitudes, effect, timber, firewood, geothermal, influence, affected, environment",,science and tech,Q,others,science&tech,Q,Ethics and Regulation,,9,analysis,,science&tech,Q,analysis,,2,3,,0,,,,others
What are the dominant climatic factors leading to forest change along the altitude gradient?,The dominant climatic factors leading to forest change along the altitude gradient were analyzed in this study,Climatic Forest Impacts,"deforestation, afforestation, reforestation, forests, forest, forestry, climatological, climatology, trees, influencing, climatic, impacts, tree, impact, factors, ecotypes, ecologization, meteorological, effects, climatol, klimapositives, geological, affects, impacted, ecoregions, climates, woodward, affecting, environmental, environmentally, climat, conifers, ecological, impactful, ecology, affect, influences, shrub, acclimatize, impacting, climate, climatena, altitudes, effect, timber, firewood, geothermal, influence, affected, environment",,science and tech,OK,science and tech,analysis,,Ethics and Regulation,,9,analysis,Q,analysis,,science & technology,OK,3,2,,,,,,science and tech
What is the source of funding for this study?,"This study was supported by the National Science Fund for Distinguished Young Scholars of China 41925030, the Youth Innovation Promotion Association of Chinese Academy of Sciences 2020370, the Applied Basic Research Project of the Science Technology Department of Sichuan Province 2020YJ0428, the Innovation Capacity Improvement Program of Chengdu University of Information Technology KYTD202219, and the Scientific Research Fund of Chengdu University of Information Technology KYTZ202242",Funding Research,"funding, funded, subsidies, funds, research, researched, subsidy, financing, fundacja, researches, subsidizing, researching, financed, researchers, scholarship, contributions, grants, support, scholarships, finance, supported, researcher, supporting, supports, grant, studies, contributed, foundation, contribution, helped, investigations, aid, investigated, bioproject, assistance, assists, study, spent, investigation, financial, contributes, contribute, investigate, search, scientific, discovered, resources, estudios, contributing, project",,science and tech,,others,factual,OK,Analysis,,11,others,OK,factual,OK,ethics and regularisation,,,1,1,1,,,2,others
