Question,Answer,Topic ,keywords,topic,Bidirectional LSMT glove v. 5 Clean,,Laura ,NLabels,,Cluster model,,,,,NLabels n.2,,semi supervised learning using  pretrained BERT,,Clusters prediction ,,,,,,,
,,,,,predicted label ,vs/Laura,Expected label ,Predicted label ,vs/Laura,predicted label ,vs/Laura,cluster,revised cluster label ,vs/Laura,Predicted label,vs/Laura,Predicted labels,vs/Laura,Analysis,science and tech,ethics and reg,others,strategy and management ,taxonomy ,factual,expected
Who published the book Planktonic indices in the evaluation of the ecological status and the trophic state of the longest lake in Poland?,"The book Planktonic indices in the evaluation of the ecological status and the trophic state of the longest lake in Poland was published by CRC Press, Boca Raton FL, on behalf of the World Health Organization, Geneva, CH",Bio-Fishery Ecosys.,"fisheries, fishing, zooplankton, bioclimatic, fish, fishery, fishes, biodiversity, phytoplankton, bioavailability, planktonic, lakes, ecotypes, biosphere, ecosystems, aquaculture, biospheric, anglerfish, bioavailable, snailfish, ecology, lake, ecosystem, biosourced, ecological, zoologii, biotic, climatology, biomass, oceanography, aquatic, bioproject, habitats, biogeography, biogeochemical, biofuels, bioenergy, bioorganic, climatological, biogas, habitat, biophysical, biofuel, freshwater, biobased, biomod, seawater, species, biomethane, ecologization",,others,OK,others,analysis,,Analysis,,2,analysis,,analysis,,analysis,,4,,,1,,,,others
What was the publication date of Climatic Change and Global Warming of Inland Waters?,The publication date of Climatic Change and Global Warming of Inland Waters was 2012,Climate Impacts,"climatological, climatic, climatology, climatol, impacts, climat, climates, influencing, climate, climatena, impact, meteorological, klimapositives, effects, acclimatize, consequences, meteorology, affects, atmospheric, geothermal, microclimate, impactful, environmental, meteorol, influences, bioclimatic, affect, influence, affecting, impacted, environmentally, effect, pollution, atmosphere, impacting, factors, ecological, environment, ecologization, consequence, affected, ecoregions, influenced, ecology, influential, ecotoxicity, warming, implications, changes, ambientes",,ethics and regulation,,others,strategy,,Ethics and Regulation,,9,analysis,,analysis,,analysis,,3,,1,0,1,,,others
What contributions did Working Group I make to the Sixth Assessment Report of the Intergovernmental Panel on Climate Change?,Working Group I contributed to the Sixth Assessment Report of the Intergovernmental Panel on Climate Change by providing information about the results and impacts of climate change on water resources and the environment,Water Hydrology,"airwater, waters, watersheds, watershed, groundwater, stormwater, freshwater, wastewater, water, hydropower, aquatic, hydration, hydro, aquac, hydrological, aquaculture, irrigation, breakwaters, hydrology, seawater, flood, climatology, floods, hydrodynamic, hydroelectric, climatological, hydrologic, aqueous, drainage, rainfalls, rainfall, headwaters, hydraulic, vandecar, desalination, influencing, wet, climatic, vapour, evaluations, evaluates, assessing, evaluating, assessments, hydrus, moisture, assessment, evaluation, airflow, drainmod",,analysis,,ethics and regulation,strategy,,Ethics and Regulation,OK,9,analysis,,analysis,,ethics and regularisation,OK,3,,1,,1,,,ethics and reg
What criteria did Jarvinen et al 2013 use to identify phytoplankton indicator taxa in Northern and Central European lowland lakes?,"Jarvinen et al 2013 used criteria such as the distribution and abundance of certain species, the trophic status of the lake, and the importance of certain species as indicators of environmental conditions to identify phytoplankton indicator taxa in Northern and Central",Bio-Fishery Ecosys.,"fisheries, fishing, zooplankton, bioclimatic, fish, fishery, fishes, biodiversity, phytoplankton, bioavailability, planktonic, lakes, ecotypes, biosphere, ecosystems, aquaculture, biospheric, anglerfish, bioavailable, snailfish, ecology, lake, ecosystem, biosourced, ecological, zoologii, biotic, climatology, biomass, oceanography, aquatic, bioproject, habitats, biogeography, biogeochemical, biofuels, bioenergy, bioorganic, climatological, biogas, habitat, biophysical, biofuel, freshwater, biobased, biomod, seawater, species, biomethane, ecologization",,others,Q,analysis,factual,OK,Analysis,OK,6,others,,factual,OK,science & technology,,0,1,,2,,,2,analysis
What factors were studied in the article by Jeppesen et al?,Jeppesen et al studied the predictions of phytoplankton responses to warming based on cross-latitude and local studies,Researching Ecology,"researching, research, researched, researches, climatology, studies, investigations, study, investigated, climatological, investigation, investigate, researcher, objective, exploration, exploring, researchers, purpose, objectives, seek, investigates, search, ecology, estudios, ecological, ecologization, seeks, purposes, studied, explore, why, geological, survey, climatic, investigating, explores, surveyed, goals, finding, explored, discovery, retrieval, studya, find, discover, bioclimatic, targets, studying, target, cfa",,science and tech,Q,others,factual,OK,Analysis,,6,others,OK,factual,OK,science & technology,Q,0,2,,1,,,2,others
What was the purpose of the study by Jeppesen et al?,The purpose of the study by Jeppesen et al was to analyze monitoring data from 504 Danish Lakes to determine if cross-latitude and local studies produce similar predictions of phytoplankton responses to warming,Researching Ecology,"researching, research, researched, researches, climatology, studies, investigations, study, investigated, climatological, investigation, investigate, researcher, objective, exploration, exploring, researchers, purpose, objectives, seek, investigates, search, ecology, estudios, ecological, ecologization, seeks, purposes, studied, explore, why, geological, survey, climatic, investigating, explores, surveyed, goals, finding, explored, discovery, retrieval, studya, find, discover, bioclimatic, targets, studying, target, cfa",,science and tech,Q,others,factual,OK,Analysis,,6,others,OK,factual,OK,science & technology,Q,0,2,,1,,,2,others
What impact did warmer climates have on shallow lakes?,Warmer climates boosted cyanobacterial dominance in shallow lakes,Bio-Fishery Ecosys.,"fisheries, fishing, zooplankton, bioclimatic, fish, fishery, fishes, biodiversity, phytoplankton, bioavailability, planktonic, lakes, ecotypes, biosphere, ecosystems, aquaculture, biospheric, anglerfish, bioavailable, snailfish, ecology, lake, ecosystem, biosourced, ecological, zoologii, biotic, climatology, biomass, oceanography, aquatic, bioproject, habitats, biogeography, biogeochemical, biofuels, bioenergy, bioorganic, climatological, biogas, habitat, biophysical, biofuel, freshwater, biobased, biomod, seawater, species, biomethane, ecologization",,strategy,,analysis,science&tech,Q,Analysis,OK,2,analysis,OK,science&tech,Q,science & technology,Q,1,3,,,1,,,analysis
How can charophyte beds help to reduce nutrient levels in shallow lakes?,"Charophyte beds can act as nutrient sinks, reducing nutrient levels in shallow lakes",Bio-Fishery Ecosys.,"fisheries, fishing, zooplankton, bioclimatic, fish, fishery, fishes, biodiversity, phytoplankton, bioavailability, planktonic, lakes, ecotypes, biosphere, ecosystems, aquaculture, biospheric, anglerfish, bioavailable, snailfish, ecology, lake, ecosystem, biosourced, ecological, zoologii, biotic, climatology, biomass, oceanography, aquatic, bioproject, habitats, biogeography, biogeochemical, biofuels, bioenergy, bioorganic, climatological, biogas, habitat, biophysical, biofuel, freshwater, biobased, biomod, seawater, species, biomethane, ecologization",,strategy,,strategy,strategy,OK,Analysis,,2,analysis,,strategy,OK,science & technology,,1,1,,,3,,,strategy
What is the title of the study being discussed?,The title of the study being discussed is Knowl & Management of Aquatic Ecosystems 44,Publications Titles,"article, articles, publication, published, publications, title, paper, journal, paragraph, publishing, papers, paperempower, journals, titled, document, jahrbuch, author, wrote, publish, subject, publishes, manuscript, thesis, cfa, item, literature, contents, topic, documents, cited, authors, documented, documentation, what, pdf, sources, source, book, who, written, cfd, topics, authorship, http, pages, citation, resource, org, yearbook, material",,science and tech,Q,others,science&tech,Q,Analysis,,11,others,OK,science&tech,Q,analysis,,1,3,,1,,,,others
What is the DOI of the article?,The DOI of the article is https//doiorg/101051/kmae/2019032,Publications Titles,"article, articles, publication, published, publications, title, paper, journal, paragraph, publishing, papers, paperempower, journals, titled, document, jahrbuch, author, wrote, publish, subject, publishes, manuscript, thesis, cfa, item, literature, contents, topic, documents, cited, authors, documented, documentation, what, pdf, sources, source, book, who, written, cfd, topics, authorship, http, pages, citation, resource, org, yearbook, material",,strategy,,others,science&tech,,Analysis,,4,others,OK,science&tech,,ethics and regularisation,,0,2,1,1,1,,,others
What is the title of the article discussed?,The title of the article discussed is Allelopathic potential of stoneworts,Publications Titles,"article, articles, publication, published, publications, title, paper, journal, paragraph, publishing, papers, paperempower, journals, titled, document, jahrbuch, author, wrote, publish, subject, publishes, manuscript, thesis, cfa, item, literature, contents, topic, documents, cited, authors, documented, documentation, what, pdf, sources, source, book, who, written, cfd, topics, authorship, http, pages, citation, resource, org, yearbook, material",,strategy,,others,science&tech,,Analysis,,4,others,OK,science&tech,,science & technology,,0,3,,1,1,,,others
How does climate affects nutrient addition and fish in shallow lake microcosms?,"Climate has a major effect on the addition of nutrients and the presence of fish in shallow lake microcosms, according to the Journal of Applied Ecology study It is suggested that changes in climate may result in altered nutrient levels, and the presence of certain fish may serve as a further mechanism to regulate nutrient levels",Bio-Fishery Ecosys.,"fisheries, fishing, zooplankton, bioclimatic, fish, fishery, fishes, biodiversity, phytoplankton, bioavailability, planktonic, lakes, ecotypes, biosphere, ecosystems, aquaculture, biospheric, anglerfish, bioavailable, snailfish, ecology, lake, ecosystem, biosourced, ecological, zoologii, biotic, climatology, biomass, oceanography, aquatic, bioproject, habitats, biogeography, biogeochemical, biofuels, bioenergy, bioorganic, climatological, biogas, habitat, biophysical, biofuel, freshwater, biobased, biomod, seawater, species, biomethane, ecologization",,science and tech,,science and tech,science&tech,OK,Ethics and Regulation,,9,analysis,,science&tech,OK,science & technology,,1,3,,,,,,science and tech
What is thegreen liver concept and how does it relate to cyanobacterial toxin elimination?,"Thegreen liver concept is an idea that suggests that aquatic macrophytes can be used to bioaccumulate cyanobacterial toxins to aid in their removal from lake systems According to Inland Waters study, this approach has been successfully",Bio-Fishery Ecosys.,"fisheries, fishing, zooplankton, bioclimatic, fish, fishery, fishes, biodiversity, phytoplankton, bioavailability, planktonic, lakes, ecotypes, biosphere, ecosystems, aquaculture, biospheric, anglerfish, bioavailable, snailfish, ecology, lake, ecosystem, biosourced, ecological, zoologii, biotic, climatology, biomass, oceanography, aquatic, bioproject, habitats, biogeography, biogeochemical, biofuels, bioenergy, bioorganic, climatological, biogas, habitat, biophysical, biofuel, freshwater, biobased, biomod, seawater, species, biomethane, ecologization",,others,,science and tech,science&tech,OK,Analysis,,2,analysis,,science&tech,OK,taxonomy,,0,2,,1,,1,,science and tech
What response to global climate changes did Lake Phytoplankton have?,Lake Phytoplankton responded to global climate changes by shifts in the phytoplankton assemblages in a small Chara-lake and influenced the cyanobacteria community structure,Bio-Fishery Ecosys.,"fisheries, fishing, zooplankton, bioclimatic, fish, fishery, fishes, biodiversity, phytoplankton, bioavailability, planktonic, lakes, ecotypes, biosphere, ecosystems, aquaculture, biospheric, anglerfish, bioavailable, snailfish, ecology, lake, ecosystem, biosourced, ecological, zoologii, biotic, climatology, biomass, oceanography, aquatic, bioproject, habitats, biogeography, biogeochemical, biofuels, bioenergy, bioorganic, climatological, biogas, habitat, biophysical, biofuel, freshwater, biobased, biomod, seawater, species, biomethane, ecologization",,strategy,,analysis,analysis,OK,Ethics and Regulation,,9,analysis,OK,analysis,OK,science & technology,,3,1,,,1,,,analysis
How did winter temperatures affect phytoplankton in Chara-lakes?,Winter temperatures in Chara-lakes affected the phytoplankton by shifting the phytoplankton assemblages in a small Chara-lake and influencing the cyanobacteria community structure,Bio-Fishery Ecosys.,"fisheries, fishing, zooplankton, bioclimatic, fish, fishery, fishes, biodiversity, phytoplankton, bioavailability, planktonic, lakes, ecotypes, biosphere, ecosystems, aquaculture, biospheric, anglerfish, bioavailable, snailfish, ecology, lake, ecosystem, biosourced, ecological, zoologii, biotic, climatology, biomass, oceanography, aquatic, bioproject, habitats, biogeography, biogeochemical, biofuels, bioenergy, bioorganic, climatological, biogas, habitat, biophysical, biofuel, freshwater, biobased, biomod, seawater, species, biomethane, ecologization",,science and tech,Q,analysis,science&tech,OK,Analysis,OK,2,analysis,OK,analysis,OK,science & technology,Q,2,3,,,,,,analysis
What are the effects of environmental conditions and morphometric parameters on surface water temperature in Polish lakes?,"Morphometric parameters such as lake size, depth, and surface area have significant effects on surface water temperature in Polish Lakes according to a study by Ptak et al 2018",Bio-Fishery Ecosys.,"fisheries, fishing, zooplankton, bioclimatic, fish, fishery, fishes, biodiversity, phytoplankton, bioavailability, planktonic, lakes, ecotypes, biosphere, ecosystems, aquaculture, biospheric, anglerfish, bioavailable, snailfish, ecology, lake, ecosystem, biosourced, ecological, zoologii, biotic, climatology, biomass, oceanography, aquatic, bioproject, habitats, biogeography, biogeochemical, biofuels, bioenergy, bioorganic, climatological, biogas, habitat, biophysical, biofuel, freshwater, biobased, biomod, seawater, species, biomethane, ecologization",,strategy,,analysis,science&tech,Q,Ethics and Regulation,,10,science&tech,Q,science&tech,Q,science & technology,Q,0,4,,,1,,,analysis
"What are the impacts of climatic fluctuations on Characeae biomass in a shallow, restored lake in the Netherlands?","Rip et al 2007 found that climatic fluctuations can have a significant impact on the biomass of Characeae in a shallow, restored lake in the Netherlands",Bio-Fishery Ecosys.,"fisheries, fishing, zooplankton, bioclimatic, fish, fishery, fishes, biodiversity, phytoplankton, bioavailability, planktonic, lakes, ecotypes, biosphere, ecosystems, aquaculture, biospheric, anglerfish, bioavailable, snailfish, ecology, lake, ecosystem, biosourced, ecological, zoologii, biotic, climatology, biomass, oceanography, aquatic, bioproject, habitats, biogeography, biogeochemical, biofuels, bioenergy, bioorganic, climatological, biogas, habitat, biophysical, biofuel, freshwater, biobased, biomod, seawater, species, biomethane, ecologization",,strategy,,analysis,analysis,OK,Analysis,OK,2,analysis,OK,analysis,OK,science & technology,,3,1,,,1,,,analysis
What evidence supports the idea that chara hispida beds are a sink of nitrogen?,"Evidence from growth, nitrogen uptake, and decomposition indicate that chara hispida beds are a sink of nitrogen",Bioorganic Earths,"soil, soils, decarbonization, organic, decarbonisation, carbonation, decarbonizing, decarbonising, decarbonize, carbon, bioorganic, biosphere, vegetation, biomethane, earths, deforestation, ecology, biogeochemical, ecologization, fertilizers, ecosystems, croplands, ecological, decarbonized, earth, ecosystem, bioclimatic, ground, crops, vegetative, ozone, coal, biogas, planting, reforestation, afforestation, climatology, ecotypes, plants, cropland, harvesting, fossil, terra, environmental, ecoregions, terre, environmentally, biosourced, biomass, groundwater",,science and tech,OK,science and tech,factual,,Analysis,Q,2,analysis,Q,factual,,science & technology,OK,1,2,,,,,2,science and tech
What is the role of charophytes in a Mediterranean pond created for restoration purposes?,"The role of charophytes in a Mediterranean pond created for restoration purposes includes providing habitats for many organisms, and they contribute to maintaining water quality",Bio-Fishery Ecosys.,"fisheries, fishing, zooplankton, bioclimatic, fish, fishery, fishes, biodiversity, phytoplankton, bioavailability, planktonic, lakes, ecotypes, biosphere, ecosystems, aquaculture, biospheric, anglerfish, bioavailable, snailfish, ecology, lake, ecosystem, biosourced, ecological, zoologii, biotic, climatology, biomass, oceanography, aquatic, bioproject, habitats, biogeography, biogeochemical, biofuels, bioenergy, bioorganic, climatological, biogas, habitat, biophysical, biofuel, freshwater, biobased, biomod, seawater, species, biomethane, ecologization",,strategy,,science and tech,science&tech,OK,Analysis,Q,2,analysis,Q,science&tech,OK,science & technology,OK,1,4,,,,,,science and tech
What is the impact of submerged macrophytes on phytoplankton in shallow freshwater lakes?,"The impact of submerged macrophytes on phytoplankton in shallow freshwater lakes is that it can structure the lake and provide shelter and shade to the phytoplankton, helping them to flourish",Bio-Fishery Ecosys.,"fisheries, fishing, zooplankton, bioclimatic, fish, fishery, fishes, biodiversity, phytoplankton, bioavailability, planktonic, lakes, ecotypes, biosphere, ecosystems, aquaculture, biospheric, anglerfish, bioavailable, snailfish, ecology, lake, ecosystem, biosourced, ecological, zoologii, biotic, climatology, biomass, oceanography, aquatic, bioproject, habitats, biogeography, biogeochemical, biofuels, bioenergy, bioorganic, climatological, biogas, habitat, biophysical, biofuel, freshwater, biobased, biomod, seawater, species, biomethane, ecologization",,strategy,,analysis,strategy,*,Analysis,OK,2,analysis,OK,strategy,,science & technology,,1,1,,,3,,,analysis
What was the goal of the study?,The goal of the study was to reveal the main factors affecting global forest change along distinct altitude gradients,Researching Ecology,"researching, research, researched, researches, climatology, studies, investigations, study, investigated, climatological, investigation, investigate, researcher, objective, exploration, exploring, researchers, purpose, objectives, seek, investigates, search, ecology, estudios, ecological, ecologization, seeks, purposes, studied, explore, why, geological, survey, climatic, investigating, explores, surveyed, goals, finding, explored, discovery, retrieval, studya, find, discover, bioclimatic, targets, studying, target, cfa",,strategy,Q,others,factual,OK,Analysis,,11,others,OK,factual,OK,analysis,,1,,,1,1,,2,others
What data was utilized in the study?,The data used in the study was Moderate Resolution Imaging Spectroradiometer MODIS Normalized Difference Vegetation Index NDVI data,Data Analysis Methods,"dataset, data, datasets, datastream, statistics, statistic, statistical, statistisches, estimations, statigraphs, analyzing, analyzed, analysis, statistically, analyze, methodologies, datasheets, methodology, meteorology, analysing, estimation, analyses, estimates, estimate, methodological, climatology, methods, analytical, meteorological, accuracy, determining, used, analytic, metric, climatological, analyzer, utilizing, utilized, metrics, predictability, method, utilisation, analyse, analysed, usage, utilization, how, forecasts, measurement, deterministic",,science and tech,,science and tech,science&tech,OK,Analysis,Q,11,others,,science&tech,OK,science & technology,,,4,,1,,,,science and tech
What was the purpose of this research?,The purpose of this research was to investigate anthropogenic activities and climate change effects on global forests by focusing on the drivers on the altitude gradient,Researching Ecology,"researching, research, researched, researches, climatology, studies, investigations, study, investigated, climatological, investigation, investigate, researcher, objective, exploration, exploring, researchers, purpose, objectives, seek, investigates, search, ecology, estudios, ecological, ecologization, seeks, purposes, studied, explore, why, geological, survey, climatic, investigating, explores, surveyed, goals, finding, explored, discovery, retrieval, studya, find, discover, bioclimatic, targets, studying, target, cfa",,strategy,Q,others,science&tech,,Ethics and Regulation,,9,analysis,,strategy,,strategy and management,Q,1,1,,0,3,,,others
What did the analysis demonstrate?,"The analysis demonstrated that with respect to the altitude distribution of forest greening/browning, the higher the altitude is, the smaller is the indicated area of forest, and the smaller is the area of forest, the more significant is the greening/browning It also demonstrated that except for the high-altitude areas in August and September >2400 m, the impact of human global forest governance activities on the greening of forests in most altitude areas and months was greater than that of climate change",Climatic Forest Impacts,"deforestation, afforestation, reforestation, forests, forest, forestry, climatological, climatology, trees, influencing, climatic, impacts, tree, impact, factors, ecotypes, ecologization, meteorological, effects, climatol, klimapositives, geological, affects, impacted, ecoregions, climates, woodward, affecting, environmental, environmentally, climat, conifers, ecological, impactful, ecology, affect, influences, shrub, acclimatize, impacting, climate, climatena, altitudes, effect, timber, firewood, geothermal, influence, affected, environment",,others,,analysis,analysis,OK,Ethics and Regulation,,9,analysis,OK,analysis,OK,,,3,,,1,,,,analysis
What are the most important terrestrial ecosystems?,Forests are the most important terrestrial ecosystems,Climatic Forest Impacts,"deforestation, afforestation, reforestation, forests, forest, forestry, climatological, climatology, trees, influencing, climatic, impacts, tree, impact, factors, ecotypes, ecologization, meteorological, effects, climatol, klimapositives, geological, affects, impacted, ecoregions, climates, woodward, affecting, environmental, environmentally, climat, conifers, ecological, impactful, ecology, affect, influences, shrub, acclimatize, impacting, climate, climatena, altitudes, effect, timber, firewood, geothermal, influence, affected, environment",,science and tech,OK,others/science&tech,science&tech,OK,Analysis,,2,analysis,,science&tech,OK,science & technology,OK,1,4,,0,,,,others/science&tech
What are the manifestations of the impact of anthropogenic activities on the global forest ecosystem?,"The impact of anthropogenic activities on the global forest ecosystem is chiefly manifested through CO2 fertilization, nitrogen deposition, and land use change",Climatic Forest Impacts,"deforestation, afforestation, reforestation, forests, forest, forestry, climatological, climatology, trees, influencing, climatic, impacts, tree, impact, factors, ecotypes, ecologization, meteorological, effects, climatol, klimapositives, geological, affects, impacted, ecoregions, climates, woodward, affecting, environmental, environmentally, climat, conifers, ecological, impactful, ecology, affect, influences, shrub, acclimatize, impacting, climate, climatena, altitudes, effect, timber, firewood, geothermal, influence, affected, environment",,strategy,,analysis,strategy,*,Ethics and Regulation,,9,analysis,OK,strategy,,science & technology,,1,1,,,3,,,analysis
What caused the large-scale expansion of forest areas in China and India?,"The large-scale expansion of forest areas in China was driven by large-scale ecological restoration policies, while the expansion of forest areas in India was driven by human land use management systems and large-scale afforestation programs",Climatic Forest Impacts,"deforestation, afforestation, reforestation, forests, forest, forestry, climatological, climatology, trees, influencing, climatic, impacts, tree, impact, factors, ecotypes, ecologization, meteorological, effects, climatol, klimapositives, geological, affects, impacted, ecoregions, climates, woodward, affecting, environmental, environmentally, climat, conifers, ecological, impactful, ecology, affect, influences, shrub, acclimatize, impacting, climate, climatena, altitudes, effect, timber, firewood, geothermal, influence, affected, environment",,strategy,,analysis,factual,,Analysis,OK,2,analysis,OK,factual,,strategy and management,,1,,,,2,,2,analysis
